{
  "$schema": "http://json-schema.org/draft-07/schema#",
  "type": "object",
  "properties": {
    "id": {
      "type": "string",
      "pattern": "^U[0-9]{5}$"
    },
    "name": {
      "type": "string",
      "minLength": 3,
      "maxLength": 50
    },
    "age": {
      "type": "integer",
      "minimum": 10,
      "maximum": 18
    },
    "email": {
      "type": "string",
      "format": "email"
    },
    "isActive": {
      "type": "boolean"
    },
    "address": {
      "type": "object",
      "properties": {
        "city": {
          "type": "string"
        },
        "district": {
          "type": "string"
        },
        "street": {
          "type": "string"
        },
        "postalCode": {
          "type": "string",
          "pattern": "^[0-9]{6}$"
        }
      },
      "required": ["city", "district", "street"]
    },
    "courses": {
      "type": "array",
      "minItems": 1,
      "items": {
        "type": "object",
        "properties": {
          "name": {
            "type": "string",
            "minLength": 1
          },
          "score": {
            "type": "number",
            "minimum": 0,
            "maximum": 10
          },
          "teacher": {
            "type": "object",
            "properties": {
              "name": {
                "type": "string"
              },
              "email": {
                "type": "string",
                "format": "email"
              }
            },
            "required": ["name", "email"]
          }
        },
        "required": ["name", "score", "teacher"]
      }
    },
    "createdAt": {
      "type": "string",
      "format": "date-time"
    },
    "role": {
      "type": "string",
      "enum": ["student", "teacher", "admin"]
    }
  },
  "required": [
    "id",
    "name",
    "age",
    "email",
    "address",
    "courses",
    "createdAt",
    "role"
  ]
}